{
  "$schema": "https://json-schema.org/draft/2020-12/schema",
  "title": "Manifest",
  "description": "Common metadata fields required by all dataset definitions.\n\nAll dataset definitions must have a kind, network and name. The name must match the filename.\nSchema is optional for TOML dataset format.",
  "type": "object",
  "properties": {
    "kind": {
      "description": "Dataset kind. See specific dataset definitions for supported values.\nCommon values include: \"evm-rpc\", \"firehose\", \"substreams\", \"sql\", \"manifest\"",
      "type": "string"
    },
    "name": {
      "description": "Dataset name. Must be unique within the network and match the filename",
      "$ref": "#/$defs/Name"
    },
    "network": {
      "description": "Network name, e.g. \"mainnet\", \"sepolia\", \"polygon\"",
      "type": "string"
    },
    "run_every_mins": {
      "description": "How frequently to run the dump job, in minutes. This option is ignored for SQL queries\nthat can be executed incrementally. By default, dumping non-incremental SQL queries will\nexit after executing once.",
      "type": [
        "integer",
        "null"
      ],
      "format": "uint32",
      "minimum": 0
    },
    "schema": {
      "description": "Dataset schema. Lists the tables defined by this dataset.\nOptional for TOML format, required for JSON format",
      "anyOf": [
        {
          "$ref": "#/$defs/Schema"
        },
        {
          "type": "null"
        }
      ]
    }
  },
  "required": [
    "name",
    "kind",
    "network"
  ],
  "$defs": {
    "DataType": {
      "description": "Arrow data type, e.g. `Int32`, `Utf8`, etc.",
      "type": "string"
    },
    "Name": {
      "description": "A validated dataset name that enforces naming conventions and constraints.\n\nDataset names must follow strict rules to ensure compatibility across systems,\nfile systems, and network protocols. This type provides compile-time guarantees\nthat all instances contain valid dataset names.\n\n## Format Requirements\n\nA valid dataset name must:\n- **Start** with a lowercase letter (`a-z`) or underscore (`_`)\n- **Contain** only lowercase letters (`a-z`), digits (`0-9`), and underscores (`_`)\n- **Not be empty** (minimum length of 1 character)\n- **Have no spaces** or special characters (except underscore)",
      "type": "string",
      "minLength": 1,
      "pattern": "^[a-z_][a-z0-9_]*$"
    },
    "Schema": {
      "description": "A serializable representation of a collection of Arrow schemas without metadata.\n\nThis structure maps table names to their field definitions, providing a way to serialize\nand deserialize Arrow schemas while filtering out the special `SPECIAL_BLOCK_NUM` field.\n\nStructure: table name -> field name -> data type",
      "type": "object",
      "additionalProperties": {
        "type": "object",
        "additionalProperties": {
          "$ref": "#/$defs/DataType"
        }
      }
    }
  }
}