{
  "kind": "sql",
  "name": "sql_stream_ds",
  "network": "mainnet",
  "schema": {
    "even_blocks": {
      "extra_data": "Binary",
      "block_num": "UInt64",
      "blob_gas_used": "UInt64",
      "nonce": "UInt64",
      "gas_limit": "UInt64",
      "gas_used": "UInt64",
      "logs_bloom": "Binary",
      "base_fee_per_gas": {
        "Decimal128": [38, 0]
      },
      "difficulty": {
        "Decimal128": [38, 0]
      },
      "timestamp": {
        "Timestamp": ["Nanosecond", "+00:00"]
      },
      "parent_hash": {
        "FixedSizeBinary": 32
      },
      "ommers_hash": {
        "FixedSizeBinary": 32
      },
      "mix_hash": {
        "FixedSizeBinary": 32
      },
      "transactions_root": {
        "FixedSizeBinary": 32
      },
      "receipt_root": {
        "FixedSizeBinary": 32
      },
      "state_root": {
        "FixedSizeBinary": 32
      },
      "parent_beacon_root": {
        "FixedSizeBinary": 32
      },
      "withdrawals_root": {
        "FixedSizeBinary": 32
      },
      "hash": {
        "FixedSizeBinary": 32
      },
      "miner": {
        "FixedSizeBinary": 20
      },
      "excess_blob_gas": "UInt64"
    },
    "even_blocks_hashes_only": {
      "hash": {
        "FixedSizeBinary": 32
      }
    }
  }
}
