{"name":"anvil","kind":"evm-rpc","network":"anvil","schema":{"logs":{"address":{"FixedSizeBinary":20},"topic1":{"FixedSizeBinary":32},"timestamp":{"Timestamp":["Nanosecond","+00:00"]},"block_hash":{"FixedSizeBinary":32},"tx_hash":{"FixedSizeBinary":32},"tx_index":"UInt32","topic0":{"FixedSizeBinary":32},"block_num":"UInt64","log_index":"UInt32","topic2":{"FixedSizeBinary":32},"topic3":{"FixedSizeBinary":32},"data":"Binary"},"transactions":{"tx_hash":{"FixedSizeBinary":32},"tx_index":"UInt32","s":"Binary","gas_price":{"Decimal128":[38,0]},"block_hash":{"FixedSizeBinary":32},"block_num":"UInt64","value":{"Decimal128":[38,0]},"gas_used":"UInt64","timestamp":{"Timestamp":["Nanosecond","+00:00"]},"input":"Binary","v":"Binary","r":"Binary","max_fee_per_gas":{"Decimal128":[38,0]},"max_priority_fee_per_gas":{"Decimal128":[38,0]},"nonce":"UInt64","max_fee_per_blob_gas":{"Decimal128":[38,0]},"gas_limit":"UInt64","from":{"FixedSizeBinary":20},"status":"Boolean","to":{"FixedSizeBinary":20},"type":"Int32"},"blocks":{"nonce":"UInt64","miner":{"FixedSizeBinary":20},"timestamp":{"Timestamp":["Nanosecond","+00:00"]},"base_fee_per_gas":{"Decimal128":[38,0]},"blob_gas_used":"UInt64","block_num":"UInt64","parent_hash":{"FixedSizeBinary":32},"transactions_root":{"FixedSizeBinary":32},"difficulty":{"Decimal128":[38,0]},"logs_bloom":"Binary","parent_beacon_root":{"FixedSizeBinary":32},"hash":{"FixedSizeBinary":32},"extra_data":"Binary","state_root":{"FixedSizeBinary":32},"ommers_hash":{"FixedSizeBinary":32},"gas_used":"UInt64","withdrawals_root":{"FixedSizeBinary":32},"excess_blob_gas":"UInt64","gas_limit":"UInt64","mix_hash":{"FixedSizeBinary":32},"receipt_root":{"FixedSizeBinary":32}}}}